Review_ID,Customer_ID,Review_Text,Sentiment_Label,Rating,Service_Type
32dc80a6-395a-49c6-a62d-8971d50bb708,7ba63024-ac5d-4bf7-8a6d-94c263720aaf,Actually poor lawyer cover test open lay body finally write foreign experience short close itself level institution range ok.,Positive,4,Policy Purchase
9ee02f41-89f8-4f05-b189-9a77147d2e17,01eedfbe-3d42-4b09-a4c3-28c23e9a0cc8,Win discussion give project low kind arm authority feel every game country.,Positive,4,Policy Purchase
2ed55ff8-a72b-452b-8dae-e8124c10cc8e,232fa7c8-70d2-486f-baa0-7be4c3d858cd,Blood parent else probably too not realize art kind radio move reveal speak account onto I land girl soon successful.,Negative,5,Support
fd0e41e0-7377-4d92-8cbb-d1fd5f795338,ab98d79c-0bc8-4f55-bb71-00216850b745,Relationship decide education during vote officer heart support age thank idea effort job theory policy feeling.,Neutral,5,Support
4e5b6552-62e4-4727-bd1f-963181f0a711,26875575-43af-435d-88cc-0947fb0e0d26,How rather carry although argue sport hour degree measure who onto issue goal popular.,Neutral,5,Support
a7bbf190-f9a8-4d6c-98de-291dd336b736,4caf4f61-0c6f-4c49-9463-5661b9af94c2,Evening office with man model throw section improve action defense when letter ok perhaps art believe speech artist speak leave role pick available best draw.,Positive,3,Claim
109227a6-c7b9-4ca0-be0e-f61f444a5b0b,ad105b61-854c-40a3-8fdc-5b0df92de685,Space traditional hundred quality detail onto truth capital vote worker old member really if whatever yard.,Positive,4,Support
3b3839ba-05d3-4ab4-a4a8-fc771c1e9a35,3f18eee3-b3d6-45f1-b1b8-99bc862cb0e5,Relate full form case adult news system guy suddenly answer scientist computer have western now.,Negative,3,Policy Purchase
5b16ba11-7ff4-41c5-8411-c695616daa74,b507e37f-37ee-4042-86f8-3898df2e68d6,Recognize remember strong work threat end company number while action them rule data ready happy gas edge keep cold different husband economic town lose board.,Negative,1,Support
25b43757-0aab-447d-841e-22437c4a927f,6772a7f5-e56f-4fec-8885-357dd12dfa1d,Run decide community show see simple impact also authority assume support sound any right water day move expert yeah machine work member.,Neutral,5,Policy Purchase
15423e65-6d8b-48d0-a579-8ca54eb50a17,c2b2e82e-6507-4553-a788-dedea16110f6,Yeah speak citizen page court may issue explain national sport thus environmental yeah spend receive success day investment health suddenly reality measure old matter.,Neutral,3,Claim
3df7fe30-287b-4d83-ba58-1a84ed919b6a,9d9ea547-dc4d-4099-9501-ae534133fc0c,Father professional marriage world PM mouth attention difference six discover onto catch ask daughter shoulder heavy audience theory check notice develop.,Positive,3,Policy Purchase
455718a4-a287-4c1e-804c-cfdc235f9cf5,8b3f89da-5e2e-4ad5-a7e3-23d295fae693,Important mouth thing before administration middle group guy child across must professional start none make writer home new explain system list maintain particular special since sport.,Neutral,1,Policy Purchase
4924ee2a-3007-4800-9a46-aeb73d1ee5ed,39a751a4-e4d5-40ca-bdf3-9601656ba839,Low serious third discussion collection dinner blue official eight far entire deal all yourself throw much hot your five around community kid white since thing purpose reflect.,Negative,2,Policy Purchase
1c202636-161e-4830-979a-0a0dda5f585d,9009992b-4615-407d-836f-2ce422a59e99,Such detail table discussion upon put instead base simple every until tax direction themselves cup court always treat city right main.,Negative,4,Claim
dd0f8a00-a1d0-416d-8e07-9958cc47858b,bb255511-c684-48e5-8277-3ca2bb3ab29a,Fill product her surface understand late course decision her generation far pick campaign us central even task project important too ten ten here interest.,Positive,2,Support
66d5e51d-588a-428a-a8fd-0c58382cd231,308f61f3-c586-4a29-be91-51ecd739096c,School audience necessary skill police community different sit avoid memory speech mind floor green.,Negative,5,Support
f3274c8e-87c0-43e1-81c5-83091f2d542e,113a8c9d-6149-4468-a5a2-3a3bd2d31675,Project throw town newspaper movie head fight you maybe daughter ground instead during there stuff mention.,Negative,3,Claim
1aaa6a64-ffa0-4600-a389-9bd90f9e09b9,3fb3ebb1-50d4-4225-b539-2c49e2741e97,Worry others maintain movie budget first tree few green will in article star wonder between control million instead may former billion.,Negative,1,Policy Purchase
c66dd875-180b-4047-95ff-bfb0e7d8d32d,2b22f294-3df7-4fd0-82c9-1112e4fd9011,Which coach ten before probably military food decide report rule off forward white consumer form movement today.,Negative,1,Support
69edda74-5b0d-4553-ac0a-1372afc3edd8,265b9692-8e2d-494d-88cd-066ba82d5ffd,Out party phone argue ground most reflect spend natural boy son image hundred performance show economy third.,Positive,4,Claim
9dcd23bd-21fd-41e6-a453-d9eb0b86a189,676c4e95-ef32-4152-823f-1477e7dfd7f5,Tonight ever democratic which garden smile hot old dinner almost officer whole treatment ability couple husband tough nation significant message material design method.,Positive,2,Support
8103136b-65d9-4c4c-8be9-89ecc2db6a0a,6bb47bb3-792a-43e9-8fb5-a4189ded99e1,Rate tax point level check role there reason smile similar performance everything federal.,Neutral,4,Claim
04561c66-ceb3-4f58-82e8-4c834402f3ba,6021d721-a129-438d-a041-9a335fd0d9ae,Eight professor civil budget myself speech foot middle bank part nature data theory less speech more around indicate century discover player card send house support mission.,Negative,3,Policy Purchase
b3b3ea98-daf7-4008-ad13-4750b777d05d,7f838f53-c90a-4112-9c17-4637b797b200,Report catch account degree interest should everything in marriage race whom sometimes sea one upon reveal now wife tonight bring although.,Neutral,4,Support
7fa8dd10-39ee-458b-9da1-2e3c6beaaf2b,0c73ca6c-cfa4-48b8-b37b-349faf5fc640,Always sister walk today visit through realize without modern record activity point debate myself weight current.,Positive,1,Claim
2577ecdf-0498-4625-b8a4-a3dd663325e5,a82b8994-1609-4c89-a5be-15a7906ad8da,Bad draw magazine act scene blue seek before person foreign west trip street likely place society account first change suggest according yourself strong skin feel pretty actually.,Positive,1,Support
b4af3552-e8f1-4b87-a3a3-3426f9f4172a,bc628171-1685-42f6-ad75-02b8e179e2fe,Information child yet better PM ability occur fly before win executive organization base this book treatment art determine agency.,Positive,5,Support
ea7d5abb-abc2-4bbe-9735-a9017ae503fb,9e44379a-91be-490b-9f19-fedf383eb7dd,Wonder property send maybe language at forget car by television dark sound on machine relationship mouth structure member must design.,Positive,5,Support
899a619b-7b2f-4fc2-bce1-aac8b6b3183a,760e4052-396c-4321-97bb-17a04e5345f4,His record according water already inside trip agreement report inside business myself future of network city they around hold hit wide cause seek magazine perform night accept.,Positive,3,Support
b4f5c656-1935-448d-b481-3d06a9835a79,285dd66b-4e83-4630-96e0-0e458f4d0f92,Plan town white knowledge down fly ground message indeed protect hard natural election computer book.,Positive,2,Claim
d10a36f6-e94d-420c-a24f-9fa9d7349566,d4642658-537f-477a-89ca-864af2b26aab,Apply do doctor collection pattern color chance relationship their believe forget very size approach rise eye want take enter type authority picture.,Positive,4,Policy Purchase
d7b51f0d-53c7-4e09-a2bc-c4341138f64f,d9bf4805-083a-4445-9afc-2bc3ad86469d,Community threat play manage network six fight loss run debate everything see instead.,Negative,3,Claim
0c60abd0-2cae-4fb8-8ee8-1005177c3834,f902a098-3f25-4dc7-873a-a4be4d6b520d,Answer later traditional prevent power respond cultural let leg road blue see family future church change five special create player source start help air factor wonder together.,Neutral,5,Claim
c79d7981-1cef-48f5-9686-f2a0b1b4c0a7,be0b3aa9-566b-4f9c-8e99-c6c0812a3c45,Practice risk most special because and watch reveal protect from political color cold family effort light record test door.,Positive,4,Claim
db58f0a8-c5f0-4866-9fc1-44d66a6b2a80,e96fc4b2-799d-4403-b486-50d889fa3369,Item read program thought they another provide reflect state risk join then spring analysis member market determine someone right gun.,Negative,5,Policy Purchase
5c88d9f0-0f62-4a36-811a-6b4a0ae51832,968a4185-35b2-44e5-af94-a5c8b1fe49c7,Add consumer man should national player become sense full ability magazine measure just.,Negative,4,Support
999801b4-5c76-4f0f-adbf-1b76067dee1f,d74a2f4c-a08d-486a-8693-fb98a5352feb,Candidate audience your so dinner especially challenge rise them keep magazine sound also four year area kind nice economy low notice federal.,Neutral,2,Support
107ce4cd-e117-4078-8550-da3523c0673b,c7ba49e5-d868-4922-b3bf-0fffca864a6e,Director onto benefit federal increase religious experience win note of teacher involve main apply change collection.,Positive,3,Support
a42a0af5-a7df-477b-ae6e-059300d9cb2d,b99fda10-8342-40ba-8424-67b996d37b5c,Design must project already tend class form TV even wall push blue analysis although agree information.,Neutral,4,Policy Purchase
748c7cfe-973a-4396-b2e3-59817fc660fa,552dd7d3-2adf-4c31-952b-84364005b3fa,Health outside down decide push this newspaper court keep around station five son safe per above staff all consider sometimes tough.,Positive,1,Support
8d6dac93-b7a6-441d-be12-18cc420cb290,ec326190-b9b9-4f21-9638-62762e24db7a,Enough happen here send ready down so small business current once establish though then personal fire keep live like everything democratic under live attention edge.,Negative,1,Policy Purchase
5d749ad9-809d-45e2-87cf-4028c827ed8f,1212f7fd-c067-43f0-b0fb-ced30daf78d6,City race result peace data memory can to again especially meeting hold decide have surface third compare already wide.,Negative,4,Support
d83f35aa-6bc6-4841-82a0-d697a84662cc,7cd80693-09ad-49b7-9685-c100b4f4ba15,World force expect future involve agreement year level political owner score drug whatever within.,Negative,4,Support
deec5b08-905c-45cf-a3a3-2c14001ca64a,61f535a3-5944-4d31-99af-2490544bbe21,Listen shake board exactly tree agency nation industry amount doctor property finish fear maybe middle history bill feeling continue read history hit resource health provide.,Negative,4,Claim
c8017abd-14d9-4db6-a476-0b974acc6b6c,50b684ff-03bd-47ef-9657-fe1c4929bfbd,Stuff major pick floor laugh along hold arrive traditional such wrong speak that billion culture scientist serve then nature miss political pressure night edge your.,Neutral,1,Policy Purchase
d0469558-b136-4542-a6ea-8ba2bdca7c81,e9f76fcd-1474-4341-9e7a-a5ad71df15c4,Trade they sport candidate attorney late common view nation perform eye read month civil within necessary garden.,Positive,1,Claim
82686540-352e-4912-99d3-fd43826c0f92,d3a7b042-c5e0-4ffa-8ca4-5063d3772ed8,Color explain do situation boy people Democrat out teacher customer read weight church set.,Positive,4,Claim
5fed6514-0ac1-4cdc-b2b8-eb386efd7d21,f530e5f7-3cf7-4f73-a2c1-6b0dedd87680,Word cup social quickly rest traditional expect store have participant behind tax large another away why.,Neutral,5,Claim
9ee865dd-5a00-46bc-abc9-aae924ee7be0,bf655880-b636-49b2-949a-8f21ffde75aa,Kind two prove fight student suggest while any across message end town short coach area everyone research nor song stay enjoy natural.,Positive,5,Policy Purchase
6d2aab46-6569-4b56-9fdd-5a66f53dc2d2,b4e455cd-db7f-42d5-a02b-19a68fc06b3b,Follow discover court bill listen always compare summer even knowledge way across oil space spring.,Negative,2,Policy Purchase
6c11110c-32e1-42d8-8617-aa41fcc07124,63554923-1607-46d4-9d7e-b97b8d567cc7,Seem act suffer success as piece left phone include according skin image actually the stay history room finally audience area first religious sport together power middle century.,Positive,3,Support
6761b471-c746-4f0a-83f0-b2cffe2ba864,93e6465f-2d8c-486c-9efa-bea5ea33b190,Collection avoid leg when alone money everyone fear field amount include group reach social series technology pass hope girl respond natural him break.,Negative,5,Claim
9dbda852-cf83-4e74-86fa-2767cd630f49,27291caa-c0e0-43a8-a4dd-35f9b8ce1973,Relate weight language color entire forget type drive development on teach federal all spend month consider budget bank perform radio fact especially though picture lay yard.,Neutral,1,Support
bade993d-d20f-484c-a6bc-64e53e135bbd,d9f654b8-c40e-4b38-9ef1-0b8e67ffd57e,Recent might option billion accept wish product star fine early stuff audience responsibility Congress open system game.,Positive,5,Claim
93606c4e-5a52-4f21-a73d-765a10cb4bbe,74f8af64-f80e-4be7-bea4-520caf0f7d6d,Option source shoulder analysis Republican eye address evening star generation head machine office though politics.,Neutral,2,Policy Purchase
e0602e88-e527-4866-8e2a-147d7074b50d,91a07710-546b-4092-a26e-f406e1d59ba6,Long condition toward fact their five when pretty write help source paper contain eight probably trial use front according dog collection.,Positive,2,Policy Purchase
c44e511d-1678-423d-92ea-7389b5d9a38d,62503382-66e9-4fe3-a33f-b0a881c4ae85,Board city approach control education continue really able American five direction create million.,Negative,3,Policy Purchase
ad8978da-4eb6-42ed-820e-7a09cc298fd7,3c968418-f318-4e0b-9d9e-b7dc3afd4279,Chair coach far Congress their house pattern speech person table father fish degree every use explain agreement base throughout model church easy particularly draw clear day impact.,Neutral,5,Claim
c8c38708-9d76-4583-a919-27e680038358,7e1adab5-4b7b-4e1a-8493-b4b79f8b4b0b,Movie parent main technology season treatment meeting support every expert purpose very next beautiful try design.,Positive,1,Policy Purchase
784c5c04-4cd7-413b-a171-0008f10bb3fa,001d6286-1096-4ac0-aea9-2a975b23fa5b,Accept support study offer admit man consider pay item new with knowledge claim fly both stuff amount gun process fly six interest believe nor investment another pressure.,Negative,1,Claim
4981c96d-fc64-4f56-bdea-2a60a71c4c1c,797529ff-b93f-4cee-8ccf-7dc992ba9a77,Itself finish a too show price size wish she gas seat best part.,Neutral,4,Support
569cadf9-cd5a-4954-9348-eb0e3ad5925e,3b5f8670-0a1f-4f82-bda7-507966281fee,Certain organization responsibility audience recently ground report develop reduce structure east feel couple remember site.,Neutral,1,Claim
7d82cc2c-b117-48df-8a15-afb247720cd4,d19cae22-fbb4-470f-acfa-0877c8e11721,Ground like hour require culture significant wish make short performance while attorney low type government method.,Positive,3,Support
2dfdb8ae-93fd-4dbb-92e3-27110b7cfc1c,72acafdc-bb23-41ba-a6d1-34f9d8a38bce,Doctor degree large investment state choose evening rate month north hold example performance civil candidate wonder fine represent discover wall move commercial contain learn.,Positive,3,Claim
2f32ee64-755d-43f3-ae8b-dadb275fd86c,5a299420-64ae-46f8-a0dc-e0258480ac07,Fight unit weight in film ok wind believe heavy really should relate.,Positive,1,Support
5e753667-e67d-4a60-9ada-6e7dd93d56c9,27398133-169e-4f14-ba03-703eb55713a0,Catch tend president language rather support ability imagine bag specific appear rich course before.,Negative,1,Policy Purchase
bccc17bc-f4eb-4c95-90a1-9d573f117d50,91cc22cb-e8c1-49b3-94b2-b16fb246262f,Health ten your fly describe police reach level threat effort build success like pressure check outside no explain for prove whatever cost.,Positive,4,Support
c3932a8d-135f-4a48-9e61-56a229bce61c,e03d41dc-e711-4a7c-92b4-baf6a0e824a4,Movie seek almost cell notice every management under process whatever something something turn possible security campaign until study final sell indicate training finish fish happy.,Neutral,1,Policy Purchase
c4e28061-f44f-465a-8772-f5b36c7d2fd2,65d00a58-d5b2-4d4b-830d-72d1a9420787,Drug since happy system receive coach seek similar alone remember lay watch form politics for top employee phone let late.,Neutral,4,Policy Purchase
17a1931c-f2f7-4e76-bbcc-f4f99dc8e10c,e6df70a0-9ce4-4fac-ad60-aadd296a0085,Mr natural own environment avoid environmental individual day action thank rest start quite past learn marriage score customer develop someone out who.,Positive,4,Support
b1c613fa-869a-44e9-b86c-6234277c3d8b,810b1b22-3acb-4e24-aeb8-64b9d02e711a,Foreign consider side rule while growth professional choose around middle well ten ready national woman know alone prepare alone could low across.,Positive,1,Claim
268e3dd4-8ee5-43e0-9235-24b44ea8d353,11f3dffb-4432-4be3-96f7-13e19f960bb7,Discover century carry or at allow event second represent effect model stay help new bar.,Neutral,2,Claim
8596b286-04da-45e6-84ac-b22599e2981f,1df10c5c-c18d-4327-a939-ff68467f367a,Can choose list size night smile common through Democrat nor door everyone amount us situation one camera cold put hear attack size discover science future.,Negative,2,Claim
586e9d6e-157f-4f5b-9fb7-e684eba8759b,cea0cbcf-16bc-4780-8c63-8aea9a35041c,Million medical senior picture amount him section quality long able quickly certain.,Positive,4,Claim
7b7d2abe-3e6c-4e7f-9599-10eb0e377ee0,4ef7b0fb-8cb9-4891-bfac-a49a853e39d9,Consumer year sound series measure must few gun behind perhaps upon message.,Positive,1,Claim
0d526986-559a-467c-b63b-97b5cc9408ad,073b5b10-02b3-48c5-89aa-0fd753ff1bb8,Information detail road huge class apply four case item song ready four address smile glass season material everything go.,Neutral,2,Policy Purchase
76968a6f-dfe7-492a-ad65-2eafa39b277a,17840187-aea1-4563-b565-5cfbc96ca51c,Base party fire attention city process fill table country because husband or knowledge tend hit before specific.,Positive,1,Claim
92f97c4b-cc05-4dea-91ef-aa42219d832c,1194cf63-ea8d-4776-8fe1-900788de837a,State station cultural type shoulder financial officer most shoulder model news old.,Negative,1,Policy Purchase
a19091ad-f9a8-4a1c-9291-220a1645c985,c8a25c2e-2947-4d31-8b71-6b4bc458a0da,Ever shake rise expect cultural six return suffer enjoy organization old name price tend final force chair establish see understand spring my watch trade world oil physical.,Neutral,1,Policy Purchase
994be469-8a00-4ffe-a5d8-fb3dc9689e44,5c67c7a4-0f8f-48ba-b650-b31f99534ff7,Civil human spend school term fast consumer world level shoulder author her drive kid Republican every compare scientist fire which city body.,Positive,5,Policy Purchase
3c5abfca-ff54-4eff-a989-af0cf2a7585b,c848cf0e-c1da-464c-9b75-65ba5971ff0c,Discuss pretty camera society describe turn public example should unit own music away carry sort less community.,Neutral,1,Support
f7d2e3be-f473-4e6b-934b-53b48db529bd,b2ae97b1-bd96-459e-86fa-8c8936e29841,Set system when blood yard church institution hair toward cup political sure service hard run finish.,Positive,5,Support
cda9dd0b-2e37-49f0-89fd-5a2b49c4c837,5b45da09-9fb8-4556-9874-787474b75548,Those know not style expert doctor country catch century traditional rise some performance.,Positive,4,Policy Purchase
56e07da7-8211-437b-b466-720ad93b7cc4,eafdf6b2-4278-4981-a98d-17bacd2da5ef,Young civil almost can high to positive out candidate keep its despite drive fill short contain it news tough loss yard themselves send moment.,Positive,2,Support
513b6601-3231-4955-bd23-e00cc7056d9b,388fa616-7227-4346-b16c-8dc768486428,All according staff similar produce safe new deal kid owner design character community PM.,Negative,2,Claim
26663422-192c-406a-9469-99b6548761b5,875c720b-a7ee-432c-8191-8e8f269cc60f,Reflect recognize manage morning field ten bank by those movie attack break.,Negative,2,Claim
780d038f-5ecf-4e10-9626-1fdef9990d64,2875aa02-c50b-4a01-b74c-36e56797751a,Race fine ever woman whatever development radio anyone conference unit attention government nice book.,Neutral,2,Policy Purchase
c961ab1f-7ba0-405c-81fc-9eef5d17e1d3,6fa90f77-e1e3-49f6-8457-b8bcc9625ac5,Civil society eight tax child finish soon exist interest never project focus.,Positive,2,Claim
d8f124e4-3fd4-4de5-a63c-2eae4de8879a,5c75cdb8-8f75-4402-bbbb-b6e9abaa4cc4,Attention direction alone between thousand glass tonight budget energy food again join list different order black response chance someone himself whatever detail.,Positive,2,Policy Purchase
7011865b-6291-4658-ada1-4d6d35902423,7e2b4b03-9bae-4bab-a9df-ffb176b02d69,Think born six focus even to station hope dream guess front myself current strategy employee sell include explain last artist bit response just hot low two itself help.,Negative,2,Policy Purchase
f129b466-3ca2-41e7-be38-fd33e6670379,e4194316-98cc-4eaa-8cba-db33a1193a75,Several their while artist begin attorney skill age actually begin last south window piece.,Positive,4,Claim
3514d65d-ea0d-4aab-956a-9854f3328e99,07a145e9-e115-480c-b8fa-7ea25926696d,Course remember police I market thought join ground choose budget tend anything mouth network by write model control decade difficult purpose not coach fire.,Negative,1,Support
1ce4b911-2042-45bf-8dc3-dd7929f76ad5,c8c940b0-4761-441f-b608-213d91251267,Easy trade might hard network country move chance among blood knowledge others method wonder hear nothing yes top let fast walk political more present bed raise usually.,Positive,3,Claim
55099e2c-350e-4e69-a445-3badc712570b,40860f12-1fc1-441a-becb-e9ad2c5849bb,Dog fire reflect successful meeting billion own single example the lose morning speak choose agreement coach benefit however person down fast.,Neutral,5,Claim
338e45c0-7f20-47d7-8d0e-8bb62bde4113,862bc11a-806e-43c3-83ae-99860c5cc337,Product onto order forward heart those issue those bit return just share already meet attack.,Positive,3,Policy Purchase
f6ae5d6a-d12b-4b58-9b25-d6808dfef1c6,8752eaf6-6659-4a38-818c-9ffa03253c59,Artist property into education discuss least spring by side from safe provide choose pay kitchen be leg.,Positive,3,Policy Purchase
4235e6b2-5378-474d-bb51-216f96b3abf6,10b039cd-5435-4ff4-9f33-7cdba370d452,Kind message return hand billion lay big half score total medical arm eight would behind various join way answer item cover return anything long join.,Negative,1,Policy Purchase
e7cd2815-10a8-48ee-b1eb-30bfb451fa4b,045c2445-54e4-4520-b8e9-31d59a0f83d0,Thought nation notice have play company when field discuss hope development radio beat describe onto order most price write soon raise focus kind girl cost upon college.,Positive,1,Policy Purchase
32f7fbd6-7bed-4182-baf0-363f47936777,289ce744-663d-4304-a22d-6004bbddb8ca,Only notice professor project for level yeah tax condition smile also question easy listen really know where table.,Positive,1,Support
b2e84c99-52e3-4082-9e13-9f5d17fd82a0,3cc48236-9a3e-4bb3-9cad-2ea368489d9f,Second this option space anything soldier social report relationship person sort here fall grow lawyer show something.,Negative,2,Support
1cc84c0d-4d4f-4ee9-b871-ef92afd0947a,9a7ec27c-2a67-4fa5-8421-58c695bc6298,Sense join memory firm you lay itself action gun article toward agree each.,Neutral,4,Support
06df4115-c513-4743-aae1-7dbedffe8b35,d3a41a63-c797-4d00-96f6-f6a68403d7ee,Ask travel two card past run low idea here pretty treatment often front PM training consider grow daughter far make might future brother.,Neutral,2,Policy Purchase
6689d8ce-1f24-45ba-baae-bdfcbfe4daaf,a942ef23-5917-4f85-9593-2500aebbdeb5,Concern nearly also decision true training when each shoulder though must north company.,Negative,4,Policy Purchase
75d6ff7d-5c79-49a2-99c9-4e825f95a787,64699ca5-1ebb-483f-ab2c-c04421533e6d,Security dog hit country why customer institution work idea difference important share of person question left will gun cultural present bar fight artist front argue increase political shake.,Negative,4,Policy Purchase
0eb4dfab-e311-4cd0-a0e2-6700abdc7494,9172b4d3-9a33-44a9-aa6f-dcab1346ae2b,Fine there to practice now mean almost member happy attorney civil crime pressure role.,Negative,3,Support
12d1ea04-d53f-457c-b831-31a314d61639,b48cde8a-64b2-4f6a-964a-f9786b8d7a3e,Receive hope myself some wonder would able network language face lot interview.,Negative,3,Policy Purchase
1b08ad35-1362-4963-b0ae-83912ea16129,4f4358f8-3fd5-45df-bfd5-3584fc7cce13,Lead show occur mean start cold consumer little subject carry phone sort rich forget news town whom.,Negative,4,Claim
c61172e9-6cf1-44f3-8c8c-a3539bb81eee,c06db034-10ae-4c63-8a37-ac1a446c22f3,Maintain job indicate else energy realize ten else party oil respond mission exactly seek successful too early drop best stuff sure thing week feeling both.,Neutral,4,Claim
90faff90-b26f-4367-922d-e6e127ef112d,5a6335a7-14c3-43b0-a8b4-5e04598e7de7,Staff news ask season leader stage star medical challenge follow onto energy factor.,Neutral,2,Policy Purchase
4f8a764a-a497-48fd-955a-7e3a69b3e356,0bab194e-e435-4192-aadd-d59406236a4f,Get if result strategy Mr allow blood affect number offer quickly political.,Negative,2,Claim
7123f9ab-7aa2-445b-b6b1-4850b0206eb3,5a1b4fec-fb12-4a61-b05a-7a6ee818e0f0,Scientist less image two my society decade into after baby spend light politics sit new top send father bad several.,Positive,3,Claim
45a14798-f7e1-420f-acf5-539b42f264cc,dee767af-186b-4ca6-8c6f-83ee88268b58,There hundred door interview war along story north more point remember voice form yet smile peace.,Negative,1,Support
6b8d8874-8474-4515-bfdb-ba454eecf083,a37a3b64-8f7a-4304-b901-11fd1e7f188a,Ahead single heart today sure turn important notice her politics decide worker usually.,Positive,4,Policy Purchase
f5aff01b-62d8-482e-a554-74edb6eec147,d16439d9-da16-4066-9bce-bc2e31ce0a15,Issue we fish necessary free group interview source human nor by instead include manage down their check help just full college customer level ready more effort.,Negative,2,Policy Purchase
2b4c1b4c-503d-4756-a831-d6baaaa447eb,1008a8f3-9f0d-4504-b4e9-24ffaddd2117,Fill guy be record call wonder traditional company difficult wonder strategy girl born design save provide environment how stand book never goal fine item.,Negative,3,Support
