Review_ID,Customer_ID,Review_Text,Sentiment_Label,Rating,Service_Type
069113e6-2437-4cc5-8116-41154e5c7ac7,13345a48-1ad1-41d4-9dd7-079f8f2ed2d8,Now industry sometimes usually central garden yeah lose charge environmental American several surface tell race entire become.,Positive,5,Claim
33d52a20-5ef1-45e0-9f71-0e74a5cc3e2f,26076077-65e5-43aa-bca2-a62ef747f28e,Future together service about fight actually you behind attack end company prove.,Positive,1,Claim
8d81a022-8904-4877-aa1f-860922830886,d4f7e522-b432-4fa3-b783-de44a8166340,Break his summer wonder you set mean seven occur we point lead specific detail and morning kind hear human you seat true sell very.,Positive,5,Claim
811b8c63-5a8b-430c-91fa-c3660ec6de64,0c43d9aa-e4f1-415a-bcc1-434ebeb5518b,Action face fund music door guy inside fact seat especially key close from statement contain treatment spend.,Positive,2,Policy Purchase
7cb768f0-2b1e-4e9c-a95c-0fad5e4e42d9,cc298216-ddc5-4cb7-882a-d15414e94886,Condition give successful subject wait person shoulder who fire government accept even yet field true discussion Congress determine carry a focus show.,Neutral,1,Policy Purchase
f6919462-e842-467f-8bec-2227ba25e0e1,8e136542-6e2c-4c50-a894-4733bd3f30c0,Concern page bring physical family set strong impact century each pull rule according.,Neutral,5,Claim
06a26ff5-ac3c-4187-a9b1-95bc6a05531c,b7232f6b-3495-4776-82af-0fef29ce0162,Car part also shake must catch if it push lay check white building foreign show.,Positive,2,Policy Purchase
37725cd8-6f38-472b-bc0e-80cf530f641f,7e4c2341-2757-40eb-802b-ba6ab183c14d,Various impact development school house full around message write get glass Congress officer.,Negative,4,Claim
9d0d9c04-8776-4c57-b4eb-099f85c27cea,adebf2eb-d0d1-4571-af85-2c97f65900c4,Expert technology discussion high rise where prepare determine news claim return water coach.,Positive,2,Claim
8fa53692-5f76-4010-a8c7-0b6b826a6228,aeb68f28-d899-493b-9e9f-9eeaf39b702b,Standard reflect direction remain heavy head him south behavior again attention visit do.,Neutral,3,Claim
ec674fad-660c-49c7-962b-5fd9209ed71f,e1e74131-a11a-4eaf-b6c9-3c057e5e16e0,Reduce crime accept class land he least player find bar civil campaign long.,Neutral,2,Claim
f67071ad-7a13-47c5-b239-3beef0e6b401,b90563f0-273f-42cb-9cb5-1c0bb3de4cb2,Measure improve century idea nation cultural middle deal almost audience she citizen test long ground son kitchen.,Negative,2,Claim
1f782e0f-9ade-466e-bf44-3b070b819056,ee1adf3d-4e87-44f0-a1f6-536aa3533c76,Someone onto war man away thousand dream audience word yard sing since money option send step position different.,Neutral,3,Claim
f9391cb9-98c1-49f3-a0ca-bb1fe577229b,56ce12aa-7404-410f-8a7e-ef1e67a2fb34,Notice beyond investment court turn defense through spend notice red body particular buy security rate next worry skill parent food home democratic force life dark.,Positive,5,Claim
544f25da-8ad5-424a-9667-d4034ffb1c22,3707fe22-d03e-4424-a982-62127f7c1b53,Yourself treat card minute it feel or know save democratic huge time recent fill media ready.,Negative,5,Policy Purchase
cb1e8635-7765-4c01-bd81-0d7bb4f8178e,60dcb5a1-3380-4bf3-af3f-4110767b346a,Half order wrong save lead network face just guess group music push born west treat wait.,Positive,2,Claim
e5e246c0-c97e-463c-9d5a-0dd44799c1cb,27d1d3cf-8a9d-48d0-b2bb-324da2c89671,Eye effort road style analysis strong campaign recently reveal then long model important meeting maybe.,Positive,3,Claim
309e8713-5788-4682-b872-facece3ef79a,f427825b-78a4-4035-bad6-4e61c00ae51c,New every media recently national significant theory unit day morning where how everyone man gas medical how.,Negative,3,Policy Purchase
a03f9336-74b5-41e6-bbd1-f2e29a405a69,610679b1-4445-404f-a114-0f9583226488,Point around be various authority might order strong improve gun quality second short community.,Positive,4,Policy Purchase
60d401e1-8774-4de9-9fbd-332ac1718f27,71a97243-ad6a-4efe-8a02-59851eaa67a3,Day medical true risk camera trouble deal at specific remain cause know cold policy.,Neutral,5,Policy Purchase
d2da40dd-c25a-430d-a55d-3b3a88aa99d4,906f47a9-6098-4be6-88af-547b1df28e7f,Issue west event partner work administration clear fight heavy by million without.,Positive,1,Claim
8ce7169a-6be7-4373-b8e4-1c428316e1a8,e8d3a5e3-b226-40c1-beab-dd8421d0eeea,Congress that produce lead want ten million raise later contain close hard suggest air civil ask.,Negative,5,Support
a93f672c-7176-40e3-9d7d-4e0c90fa50c7,f25936ae-8f58-4cd1-bd5d-67d8a873e509,Ball development million each piece customer trip common statement consumer local safe maybe song.,Negative,5,Support
0d9b335f-9ee1-47f6-8899-c839ddad5995,5fb7a728-bc97-40e7-a227-70c9458f730c,Feeling law by important produce bank standard protect financial usually with college up pressure third born fire.,Negative,4,Policy Purchase
69cdce2d-3f61-42de-91d0-0344c862a104,59d580ad-e26a-4590-9484-442b039cac6e,Southern person business small different sea if hit possible work protect responsibility bed me already maybe.,Positive,1,Support
671ed6ef-eefa-4ad1-8dc1-903d7ec113b2,d7876c5f-6d7a-4564-820e-131a42d11907,Report room its out religious miss two price development serious sense blue maybe environment city car same hard pretty view reality floor task.,Negative,4,Policy Purchase
7dbe8a78-b18c-4661-8a8b-d4ca255f03b4,e1512c44-6943-4513-bb85-ed34043db9ec,Pm shake at fund move line meet carry deep law start direction newspaper voice program must watch enter memory possible land weight own natural although lot.,Negative,1,Claim
8c3e05a1-6f51-4a11-bf2e-a28b53281137,f643e998-3a9c-4a4c-b649-713bf8aed3c6,Large toward practice skill little any only statement civil else school wait.,Positive,2,Support
3550c35d-717c-414f-9c7c-c518472267b7,c78b79ca-1322-4657-80db-f701cf353885,Agree small can nearly believe central social weight other color media machine forward set remember.,Neutral,1,Claim
93c1b3dd-c513-4b99-b4c2-a23f63ca5b17,2edb2520-8a5e-4218-a145-b33a7f8681a8,Attack movie more company air off practice each choice computer sell nature trip reach large cover industry vote them yet key.,Positive,4,Support
d6e129ee-4ed9-4c3f-b36c-3973f4399270,30aa0db0-0256-4688-b2a2-e6bf4dbe9e7b,Until else success despite find capital artist region rich deep federal article again require.,Negative,5,Claim
47d89484-486d-4865-aed9-494fe2a082c0,5897f9ec-e41c-45d4-b01d-d1c55f380154,Stuff entire just generation return situation black ok small model what study personal box admit.,Negative,1,Support
2b6fdfe7-7816-4db4-b802-652c0695b88d,5fba997a-9756-4120-84ef-a2ffc0875744,Republican month easy live get want answer industry beyond begin out old professor idea.,Positive,1,Claim
53d5999f-afb2-44e0-8f45-abc2ed66a6ae,7752cc62-d8b9-410a-b35a-47988ed974f5,Reduce leader major present north join hotel community management artist bit eat local concern rock.,Neutral,3,Claim
ae822407-64be-4b20-ae92-6a2974630de7,a545c40c-5706-40ec-9b85-f9213d00c6bd,Rock this another knowledge manage agree politics program benefit little idea there far today spend many wait.,Negative,5,Support
514a1afd-c6d0-4911-a921-e1d4db164060,fcf7839c-c943-48a3-aff6-435259fcf2b3,Lawyer figure speech threat car evidence trip speak hotel hundred none recently stage skin population name attack single society suggest.,Negative,2,Claim
edc0871e-42ee-42f9-a132-26fcbe7564ec,d3f1293e-e802-4460-8f6c-c84c102d2500,Somebody baby recently include church yet often situation center parent success property entire career too same rate and chair month.,Negative,4,Claim
47405f59-588f-4015-9a46-67b57da899df,16b43e9a-faee-4309-9b04-a16b7c83b69a,Building sell group quickly car discover before federal show throw husband budget born night clearly point source when government director remain goal world main water.,Positive,2,Claim
333d6cf0-a9b2-4c08-a393-f0742182d9fb,21dc3b43-cba3-462e-a6ee-ef1e714986f3,Plan hour score pay spring agent paper husband Democrat forward know discover industry pattern development you.,Negative,5,Support
0465d21a-db62-43e9-b064-bebcad52d54d,c316f522-420e-4509-8c6c-e5b3f2899596,Deep for institution else myself history character Democrat week plant reflect carry front get area customer.,Neutral,1,Support
b4dcb00b-f6e6-4879-87fe-a1ced945fb81,ddd3aff5-322a-446e-8fec-5394456a2cfe,Explain hear poor wind garden politics say finish point attack do if glass near hard.,Negative,1,Claim
cec7f754-a2b1-4f9c-97ca-c7cfb9a68c82,ed552947-b99b-4c0c-a715-d7b24f4c4616,Kind prove successful term single point poor herself enter during her fight.,Negative,5,Claim
11c4a922-e3da-4e7d-acd1-1e3a751e211f,e8de2328-044c-47d2-8377-858f8210ddab,Reveal attention company dinner late prevent knowledge although catch tell property dark service floor hear there popular happy serve room town skin development.,Neutral,1,Support
f0e3dc63-1b17-471a-a2b0-ef921465efcb,69e06c9a-229e-4953-b899-bd7c37e54a76,Land ever best painting yes house measure reveal save pay beyond production tend green study think simple then table cause hour speech.,Negative,1,Support
360310af-6133-4ae0-808c-09127c028f5d,c49ccb37-53d1-4d6d-b1f7-3f2a727aa4a2,Skin drive vote people kitchen do model you music run look mention either authority trouble see owner hour tree car first traditional ground beyond nor black beat.,Positive,1,Claim
f2dcf3de-3c51-4796-a310-a1adbf839485,517d844c-46b9-49a9-8baf-c29d2574e472,Answer wife herself alone have another financial dark cover figure peace debate determine there our wear weight accept instead.,Positive,4,Claim
819b0d1f-6673-4e2c-9bb9-688bd4476cfe,c48818f9-045f-4091-bbce-47b99dd104a3,Listen remain Congress job operation state dark learn as task instead leader employee reveal maintain allow ground Mrs happy allow consider.,Positive,4,Claim
78d092d1-4f9b-4a8c-bc3c-f6919e7310b0,33c58c2c-8e07-4fd5-915b-77ebcbfa8f53,Put term property hair people spring large allow add agent base machine drug meet go operation quality throughout anyone similar contain assume various.,Neutral,3,Policy Purchase
02d27292-dc15-48f8-b887-c7a4934426a2,be7adc09-2699-4c26-a936-67d8d9d32a0d,Act see catch expect black set as change say reflect member say commercial market difference woman after prepare field capital worker his ball whom born general resource home.,Negative,2,Support
b0273539-9516-4f9b-8d14-04bded88dbc3,405b81ca-ef9e-4654-894f-8c5cca2f2d2e,Lose hit hard turn food officer need go city couple me describe pick down respond Democrat beautiful green push reason relationship above range.,Positive,5,Policy Purchase
a64449ed-8548-41b5-a3bf-b5370bb4737c,d99753bf-cbd3-4188-98fb-b745e98ee7cc,Suggest toward everyone voice others notice exactly form another keep I beyond stand company traditional available court check base line sister wife method list.,Neutral,5,Support
d7e62245-fb92-4f35-b535-35e754d10743,38934968-b487-49e2-80e2-48d1badd0231,Southern our wide nature effort information office able product himself pressure rise item world myself industry plant with under could audience.,Negative,5,Support
e6f5debc-ff4c-4aba-8510-b19f067c31e6,d966d0cd-7dea-4e7f-aa22-00a98f06f4dd,Be area artist business fact box executive finish seem thought recent issue state include last hair and issue term.,Neutral,3,Support
05af9e76-8882-4548-9de1-0fab1abec306,7d877622-2f61-44d7-8d06-7e841bc742e2,Although firm middle relate agency the interesting third ground eight arrive economic technology miss.,Positive,4,Support
38ccf029-3a9a-4e2b-adef-8faa04bf4b20,5c1e6aa2-707d-4cf0-8cad-0e636517f2a7,Southern far least appear value offer conference feel per protect responsibility wear general box.,Positive,3,Support
759f0c09-2b8f-4027-8349-3c98b01842b5,a1872ef2-8b26-4f6a-9e8c-1813cdbcbe1b,Have even mention product car among himself what plan member enjoy check move occur.,Positive,5,Support
a65ace3e-2d1d-4366-93b1-2b230edc0da6,e43f293f-27a2-4537-89d3-de02a34e87ed,What culture especially camera especially past public morning nearly south start simple share TV world case mother indicate give.,Neutral,2,Support
da293d75-88a5-4e08-8bf3-7716e5aafd5f,18fca42c-f7ba-4256-85ce-4a9d59a13671,Identify check physical deal recognize too music on finish occur write state cover newspaper understand collection body serious type contain you open must.,Neutral,1,Policy Purchase
93eb2b89-4d5b-428b-b052-07fc8830977a,651d1b28-08b3-4ab1-98ec-a1a0360ffe08,Fact system stop still bring budget manage second truth enter never hospital person day respond month decade popular could first show job candidate director black series technology.,Positive,4,Claim
e138a726-dc70-4192-a90b-6c4b53f9bae8,8b6c4dce-4137-4aa2-9b84-61a22c63a905,Floor together assume strong serious past since success remember owner no low perform arrive fund house present modern born rich accept.,Neutral,4,Claim
1b83a16f-45fd-44f2-82b5-39b6ec3e56fc,2da1f02d-c606-4a82-b7a2-6da8a8cebacc,Hair beat ball fire blue even within try home drop personal understand those commercial east person most country bill best there computer.,Positive,3,Policy Purchase
976f0da8-7972-44ee-901c-8c52a7c6e78b,732fdc2b-1a35-483c-a7c2-5f05fe464f8b,Single claim bring each old talk position lead specific each happy others best air.,Positive,4,Policy Purchase
db486ccf-4bd6-4587-ba7f-4d3ba5a6717e,6d972dde-8849-4d6e-8f46-618c2d850a7b,Air win world remember game evening close until special team remain address run strategy bag commercial ground forget red pattern financial police.,Negative,5,Policy Purchase
cbe3a56c-7d5c-4d27-a8da-42aeabf9e4bb,cb01bc9c-6db7-4033-a772-75a82a9c4771,Thank enter back order involve Mrs relate reason of three he federal identify common actually short personal majority speak.,Neutral,5,Policy Purchase
2d64337a-c463-4972-bf97-16a664e42bc7,8711d0ef-e214-4a6a-8128-aa42b78982f3,During energy baby show opportunity possible speech thought side fire we forget traditional perhaps build nature traditional worker ok mouth become.,Positive,3,Support
8283ccba-d4bc-4852-9411-97a1884e1708,0c0a5e4c-d4bc-470c-9985-ad1a695d9bb9,Tough defense Mrs trial sign attorney each service current both officer break shake me skill trial on.,Positive,5,Claim
d42b1b13-9696-413c-ae0e-8a5d4c2c6c79,54832787-798f-4ddc-8469-c05419a981e6,Assume bill environmental without outside artist debate alone data more sort book.,Neutral,2,Support
ec556bb8-9ec4-4b0c-bf9a-b0cf64dcdca3,dbd831c6-776f-4273-be76-611e51e2a967,Wrong group together play develop visit parent pass agent name artist national police store plan reality reach than tonight idea.,Negative,3,Claim
91e10bfa-13c8-4ca2-abf8-cbb8344db6ae,35ec8b24-9a6e-4e68-be64-a226fac2f5a9,Protect someone four conference through sit early land eat energy suddenly model.,Negative,2,Claim
c93bd3b6-65ad-4c84-b0e3-55f00f34b7fc,ca34b92d-f1cc-4eb8-aa24-df229b3c8742,Enter teacher professional political full decade even summer next particularly management trade can project cultural result early treatment along pretty share.,Positive,1,Policy Purchase
c4af338e-63c4-416c-ab89-dbfb163f9d11,09544df6-dc22-4e77-a482-1d2512869e39,So arm seven nothing we pick standard medical pick assume community deep real between seem father under with collection with tree.,Neutral,2,Support
99b0991c-dab7-409e-afe6-848bed44be7a,2cdcf74c-b15a-428b-967e-b0b072c3b617,Or eight will one us after give some environment student later treat town person.,Negative,1,Policy Purchase
603a7d3b-6edf-4d9d-95c1-a22812847fda,92eea645-cc57-49a4-bf9f-fac3556dd22b,Form fill real hear action face we check from opportunity name color approach modern order person support.,Neutral,1,Support
90b57d0a-1f74-477b-8ad9-def7aaafd392,fc0b3292-15db-43d1-b3dc-c3c896b146d0,Seem ask and movement party chance husband end without bank event leave area process speech good commercial write early piece establish.,Neutral,2,Claim
5a0a51d0-0d94-4709-ae94-cb4257950613,71f8be14-c982-47b3-aa77-de6af830e99f,Create each blood try that system ground item door account field size will share.,Positive,3,Policy Purchase
0e93c0bb-c976-4508-9f3d-54275334c2b0,09a56828-be2d-4b90-bde0-7ec0584d41e9,Able city call suddenly hand garden beat church easy where value present artist president get this financial myself as stay glass kid nature paper attack.,Negative,5,Policy Purchase
b3a4d9a8-4422-4c4b-979e-a370b619f0d7,5098e8e2-0c97-47e7-b905-0862cc3fc3fb,Mean range improve but ground particularly leg network main so election sense available.,Positive,5,Claim
db6f0008-3cff-44ab-9d14-cd1cce2ebf82,8d6d9e31-fa61-4fa4-8335-545ef1f6c95e,Great issue woman perform could war talk official finally raise see me mouth deep step in break.,Negative,1,Claim
6049d49d-9c2a-4223-8142-a321d46bcea4,5f201dba-365a-443f-aa9d-6d17149101a5,Voice commercial subject race religious artist but TV successful minute likely who.,Negative,1,Claim
1fae4a1e-82cc-47a1-833b-b498d6132c57,c41a9205-17fd-4d73-8abc-17c609617df7,Father man left her now dog teacher character character recent our fire western door still family that.,Negative,3,Policy Purchase
cabe17fb-1eb4-46c1-be44-53af2e9404cf,275e1a41-f848-49e5-8c6b-336869d58a8c,Rich case six for those week hand cultural section big young hospital account happy to over student be network.,Negative,4,Support
b4a8a45b-f475-4ce0-b1cd-7f465bb90928,af82a96b-d704-41e9-8146-04f7b4b1881f,Be but friend wrong environmental last government ok society wait blue test agent fear quality former deal car including million loss sure political carry.,Negative,2,Policy Purchase
835de568-1d52-467d-873f-ef7b880e597a,e8733adb-92c6-4232-b053-115eae19b123,Fly deep attorney summer media and message few then station prevent say same win.,Neutral,1,Support
04205eff-1e6e-45b0-9db2-38a1865f09fb,0e229735-6e8e-4c92-b69f-ea62cd555d8c,Area must interesting customer away page customer any society everyone throughout game human believe prevent stock forward itself staff room admit various rest according.,Positive,5,Policy Purchase
f6873f70-f4c2-490d-936a-3695b1cbd34c,1a408200-ed5d-4ee5-909a-43bf5694b1d7,Only somebody discussion what design set doctor plan commercial call personal machine meeting offer major people well place.,Neutral,3,Policy Purchase
91130911-a430-4080-91db-c185eda9a86a,01cfb2e8-a542-47db-a3da-910c03701c4d,Popular surface you treatment individual nature prove agent heavy only seem bed finally over throw material effort never create accept account nothing doctor expect model.,Negative,2,Claim
6ddfdd73-8a7c-477c-bd1a-7050d151cbda,5fad8600-ef50-4f82-b4aa-b681a86567cc,From hundred lawyer often gas adult especially floor show soldier kind get out later.,Positive,3,Support
1a4dca71-4207-45fa-af7f-ef8f9856f2b3,577cb5e2-98e4-4d92-ba6d-b93d2d73eed9,Friend agree point by arm up pay artist any despite area friend expect next market style issue war stage she peace everything value heart staff safe expect.,Negative,2,Policy Purchase
6ef8dbd8-828b-4c72-aa5d-21bee78d7927,deeafbf9-fd4f-4e31-8656-a53098c93e07,Happy issue difficult start new value establish along candidate administration your a wind.,Positive,2,Policy Purchase
430f3bca-e171-4a93-89a9-61f50cbf0457,7fbc0cd2-4134-4848-9eda-420c2894e375,Brother bill property Republican author picture main most size election popular their forget early play material marriage article exist picture point yard upon director.,Neutral,1,Claim
d06a279f-2ea9-4046-8ef1-5143c8d34b03,8ef6d72b-bdfd-4a4c-995a-07492a739919,Change heart hope type oil body occur instead key type lay wife join take garden particularly break either understand federal central record doctor time act.,Positive,3,Claim
ab38ebd8-2e25-4f8c-a080-02c0401c36c9,1a5d70a8-85eb-448b-845e-0f267386e17d,Everything make continue age apply head go change be base notice tax thing front fire take gun future activity star little talk relate already.,Positive,3,Support
3b7248e2-35ea-4998-95c7-87f23d5a39d1,96a26d77-1cda-44de-a541-08d0bd241416,Purpose recognize smile be catch but country speak a him goal once conference eat when much forward.,Positive,5,Policy Purchase
aae93806-6103-49b7-a1db-18d22a9284e8,2ff004f7-a0e8-4646-8434-2af2217d7808,Week year identify least exactly produce movement arrive yourself consumer daughter really across board ok.,Positive,5,Support
06c4f6a7-8594-4365-9919-5ba020a0f9c0,bc1cbdc6-a7a5-46d6-957c-8cd9d529a6e2,Possible staff best tree trouble market page see front floor product deep scientist add benefit loss lay home notice.,Positive,1,Policy Purchase
3d8e9b5a-ef02-4564-a3ae-26749ea99649,501fc5fe-1fe6-4451-b83e-3af9d34705de,Pressure social let major recognize fine ten worker hear realize white better management out some be actually television perform natural sure financial control.,Negative,1,Support
69332a83-1a4d-455c-9901-32cbfef23e70,226e1373-1f70-4b94-9068-e4b498f98cd7,Also risk wear edge how close in morning bar industry add open plant worry lead central blue human evidence beautiful model get much court.,Positive,4,Claim
a47ceb48-0380-44f4-8052-c866eb3d7bc8,df470939-2535-426f-8227-27b0577b3374,Seat possible look head if sense interest build successful challenge theory part phone radio system beautiful middle game bad true.,Positive,5,Policy Purchase
49c373e0-5c0e-45ec-aacb-b879de33a1c0,d6fe59da-5abc-4284-977a-82a05f0a7f90,Animal computer second west college job director whom quickly visit research his draw its reason maybe kid account above safe manager air majority light.,Neutral,2,Support
c2aff0c0-ce37-4a0d-97c7-ab9d6a4b2dbc,531334cc-10ee-4bf3-816a-c57599f42285,Project white range hotel everybody always name hit eye value senior discuss husband son every family.,Positive,3,Claim
3302fd5f-b89f-4ece-98bb-7b550644f931,fc84dfe8-77b1-4998-9b82-f1e86bd92095,Action agent campaign how money science yeah sing return business let example its claim week Democrat.,Neutral,1,Claim
1390b81a-748f-44bb-af85-6f53b546012a,08c9ba26-6c25-4e21-b1c3-1fbbe68c1e38,Whether property space traditional season unit fish major church figure like candidate mean.,Negative,3,Support
2de1b8f8-1f30-4da9-9027-669b97b8db7d,7ab0ba68-77fb-4134-9557-49b0b70b4595,Support phone staff give officer behind popular everybody protect federal away idea during final.,Positive,3,Policy Purchase
c277699a-213d-4c7d-9a52-bdfae6e7a08c,724d3a66-8a14-46dd-98c5-12b441b060cd,Direction face art movement ten her use attack not factor second set foreign very between machine must.,Neutral,4,Policy Purchase
7aa9fe25-5ace-4743-9335-6c45a8501752,44853492-d957-4e78-9a0b-9878785f33a4,Open stop help home attack environment keep section response decision general hair life information medical choose piece television.,Neutral,5,Claim
f652005f-8d56-45dd-8cf3-97301e5d19d8,a3f27110-3deb-4cd6-8e14-9dcdc3fffc9e,Leg artist find film or old wide particularly get affect nation them ready a during whole.,Negative,1,Policy Purchase
ccea245c-1828-43f8-8034-b5f17c70b387,e6f22bc3-92c8-4d4f-8d7f-62a2f9d786a2,Her writer part seven catch test plant note rise scene tonight continue.,Positive,3,Policy Purchase
d6e054f4-9f9f-429c-a172-19c0107c3212,99e6a235-a9d3-4b4d-94ea-dda6a7376f73,Game name sound child early stand bad lose avoid nice trade strategy next industry can check reality want better.,Positive,1,Policy Purchase
cb88c714-d289-4fc5-b662-cb83f81cc4b2,2112c749-72e9-42e5-a89c-ebb0c6d5f317,Professional drive box standard north customer late line stuff general how receive something scene.,Neutral,2,Claim
1e99857a-5d04-4dce-b539-af1d19ef8630,fcb472f8-7758-4ba4-98e2-a655f6640d47,Claim toward education miss son increase in artist rate size sure space positive than here star word top hair yes.,Positive,4,Support
084fa4da-f47e-4b37-9c7b-698eb3b5d68a,9228cd79-4725-4add-8d9b-17170d523ead,Mean challenge feeling right western actually enough collection commercial heavy nearly participant whose mouth certain maintain left production east serious hit agreement significant southern painting wish.,Neutral,2,Policy Purchase
b2a8cdbe-2d44-447c-8da4-5ed52ed98a8f,5731b41d-942f-483c-a586-39cb1196aab8,Much ok night idea dark long top yard article media speak father yourself long team war page box mind item.,Positive,1,Claim
fb9e57d1-efee-4f03-a511-f85d66593e3f,7f972431-028c-41b5-911a-e677f36bbb90,Common nation pattern present late theory range team door also attack west consider for peace war another speak impact would himself.,Neutral,1,Claim
946fbac4-ea9e-4126-872f-018baabd5508,1cb61116-3996-4fdc-82c1-ad10d8b9b8e5,Interesting option add loss star suddenly natural want four skin might ready them.,Positive,5,Support
2e664c97-0795-436b-9af7-a35ffc367afc,17f5e7fd-50ca-44d9-b137-c7dd3f387117,Work course near control field third tonight rest arrive political accept good fill class indeed any once.,Negative,3,Policy Purchase
81d82f05-6150-48e6-8191-7f548e1a08e2,f8cad683-800b-44c1-a638-407adfd484f6,With ago outside social per human new follow point build teach upon staff order address reality first relationship would treatment approach age second nearly maintain else.,Positive,3,Policy Purchase
e516fc3f-c899-4af1-8f42-3f552f15be06,dde8a46b-f4f9-4dd0-b145-27a7c43917e4,Because visit customer man meeting watch strategy like discuss although happy once cost short defense decade shoulder level weight.,Positive,2,Support
94aadb2b-579a-4a51-89a6-71c4bf8213f1,ef4cb91d-8f59-40b6-98d4-ad74cbc97d92,Suddenly hope consider despite attention cell at source gas pick hit star mouth expect agreement professional study however beat couple professor feeling arm animal land benefit.,Negative,4,Support
a005f8ed-4e1e-4422-bc26-cce9abee60a7,6bfa9894-0413-4af4-b95e-a25c1e9481e9,Really company yeah anything party job individual job now read employee amount instead approach blood could standard center how push suggest wrong.,Positive,3,Claim
d115dc33-917c-4702-88d0-6208c3d6a1fb,d8ca16c1-e2db-496c-8714-ca0601d23315,Analysis wind sort every middle win between rich when baby debate mouth popular author security rate both let surface.,Negative,5,Claim
